{
  "$schema": "http://json-schema.org/draft-07/schema#",
  "title": "plan step answer",
  "description": "What the plan step returns to the driver: a decomposition, or a question that parks the ticket.",
  "type": "object",
  "additionalProperties": false,
  "required": [
    "step",
    "skills",
    "status",
    "premise",
    "designSource"
  ],
  "properties": {
    "step": {
      "const": "plan"
    },
    "skills": {
      "description": "Every Superpowers skill invoked in this step. The driver cross-checks this against the Skill calls in the run log, so a claim here that the log does not show is a failed step.",
      "type": "array",
      "minItems": 1,
      "items": {
        "type": "string",
        "pattern": "^superpowers:[a-z][a-z-]*$"
      }
    },
    "status": {
      "enum": [
        "planned",
        "park"
      ]
    },
    "designSource": {
      "description": "Where the thing being built was settled. `approved-picture` is a design a person approved before the build, and it names where: the driver's compare step holds the renders against it, and a plan that claims one without saying where is refused.",
      "enum": [
        "ticket-body",
        "brainstormed",
        "debugged",
        "approved-picture"
      ]
    },
    "premise": {
      "description": "The premise verdict. It has no automatic form: a mechanical path-exists check measured 0 true positives in 25, so the verdict is a reading and the evidence names where it was read.",
      "type": "object",
      "additionalProperties": false,
      "required": [
        "verdict",
        "evidence"
      ],
      "properties": {
        "verdict": {
          "enum": [
            "still-true",
            "already-fixed",
            "changed-shape"
          ]
        },
        "evidence": {
          "type": "string",
          "minLength": 1
        }
      }
    },
    "schemaChange": {
      "description": "True when a task in this plan changes the database schema. The driver refuses a plan that says true and names no reviewed data model: a database change invented inside a ticket is the one mistake a later ticket cannot undo cheaply.",
      "type": "boolean"
    },
    "dataModelSpec": {
      "description": "The reviewed and approved data model this plan changes the schema to, and where that approval is recorded. Required whenever schemaChange is true.",
      "type": "string",
      "minLength": 1
    },
    "tasks": {
      "type": "array",
      "items": {
        "type": "object",
        "additionalProperties": false,
        "required": [
          "title",
          "files",
          "tests"
        ],
        "properties": {
          "title": {
            "type": "string",
            "minLength": 1
          },
          "files": {
            "type": "array",
            "items": {
              "type": "object",
              "additionalProperties": false,
              "required": [
                "path",
                "action"
              ],
              "properties": {
                "path": {
                  "type": "string",
                  "minLength": 1
                },
                "action": {
                  "enum": [
                    "create",
                    "modify",
                    "delete"
                  ]
                }
              }
            }
          },
          "tests": {
            "description": "The tests this task writes first. A task with no test cannot be built test-first, so the contract has no shape for one.",
            "type": "array",
            "minItems": 1,
            "items": {
              "type": "object",
              "additionalProperties": false,
              "required": [
                "file",
                "behaviour"
              ],
              "properties": {
                "file": {
                  "type": "string",
                  "minLength": 1
                },
                "behaviour": {
                  "type": "string",
                  "minLength": 1
                },
                "redWhen": {
                  "description": "The production change that makes this test fail. A test whose author cannot name one is measuring the shape of the code.",
                  "type": "string",
                  "minLength": 1
                }
              }
            }
          },
          "risks": {
            "type": "array",
            "items": {
              "type": "string",
              "minLength": 1
            }
          }
        }
      }
    },
    "question": {
      "description": "Why the ticket cannot be planned. Answerable in a line: a yes/no or a pick.",
      "type": "string",
      "minLength": 1
    },
    "questionFor": {
      "description": "Who answers the question. `owner`: pixels, a picture, a product or commercial call, or the data model. `pm`: the ticket's shape — which repo, how it splits, the order, the wording of its acceptance. Unsure is `owner`; the driver treats anything but `pm` as the owner's.",
      "enum": [
        "owner",
        "pm"
      ]
    },
    "notes": {
      "type": "string"
    },
    "designRef": {
      "description": "The approved picture and where that approval is recorded: a URL, or a path on this branch. Required whenever designSource is approved-picture.",
      "type": "string",
      "minLength": 1
    },
    "screenStates": {
      "description": "For a change a user will see: each screen state that shows it, so the driver renders exactly that rather than a page's standard states. `route` is the page; `setup` is the ordered steps that bring the change into view, written ONLY in the vocabulary SCREEN_STEPS gives; `shows` is one sentence on what a reviewer should see. Empty when the change shows on no screen, or when SCREEN_STEPS says the renderer takes no steps.",
      "type": "array",
      "items": {
        "type": "object",
        "additionalProperties": false,
        "required": [
          "route",
          "setup",
          "shows"
        ],
        "properties": {
          "route": {
            "type": "string"
          },
          "setup": {
            "type": "array",
            "items": {
              "type": "string"
            }
          },
          "shows": {
            "type": "string"
          }
        }
      }
    },
    "screenChange": {
      "description": "Whether a user will see this change: `visible` (name the states in screenStates) or `none`. compare refuses only a `visible` change with no state named.",
      "enum": [
        "visible",
        "none"
      ]
    }
  },
  "if": {
    "properties": {
      "status": {
        "const": "planned"
      }
    }
  },
  "then": {
    "required": [
      "tasks"
    ],
    "properties": {
      "tasks": {
        "type": "array",
        "minItems": 1
      }
    }
  },
  "else": {
    "required": [
      "question"
    ]
  },
  "allOf": [
    {
      "$comment": "A schema change names its approved model. The driver reads the same two keys; the contract is what makes the two agree.",
      "if": {
        "required": [
          "schemaChange"
        ],
        "properties": {
          "schemaChange": {
            "const": true
          }
        }
      },
      "then": {
        "required": [
          "dataModelSpec"
        ]
      }
    },
    {
      "$comment": "An approved picture names itself. The one fact this project's process turns on had no value in the contract, so a picture approved the day before had to be answered as `ticket-body`.",
      "if": {
        "required": [
          "designSource"
        ],
        "properties": {
          "designSource": {
            "const": "approved-picture"
          }
        }
      },
      "then": {
        "required": [
          "designRef"
        ]
      }
    }
  ]
}
